{"instance":"pb-0044","solver":"vroom","routes":[{"vehicle":1,"start_time":46800,"visits":[43,42,28,27,36,31,37,24,25,33,40,34,35,44,32,26,22,30,49,23,0,58,59,65,63,51,46,54,53,52,55,56,64,3,11,15,7,14,18,8,20,13,9,21,16,12]},{"vehicle":2,"start_time":21600,"visits":[19,17,50,48,61,60,57,62,47,45,66,84,67,82,76,70,96,69,93,97,85,89,83,98,92,71,87,78,81,100,77,99,88,95,2,4,74,72,91,73,1,94,79,86,90,68,75,5,80,38,6,41,39,29,10]}],"unserved":[],"runtime_ms":612,"meta":{"routes":2,"unassigned":0,"duration":17287,"cost":200017287}}