{"instance":"pb-0219","solver":"pyvrp","routes":[{"vehicle":0,"start_time":57600,"visits":[102,371,244,273,55,157,354,508,665,391,692,50,422,146,633,505,80,312,349,538,571,57,629,272,572,632,427,514,53,656,97,296,666,316,255,286,300,200,535,569,330,396,418,143,251,215,669,309,160,155,584,258,241,274,243,140,423,694,216,163,86,41,242,48,147,609,369,509,213,119,109,466,123,653,294,410,81,544,439,495,661,194,503,85,408,310,374,436,153,208,302,156,610,471,2,606,183,132,573,534,496,7,18,46,333,8,619,24,541,353,450,659,186,164,443,32,319,566,688,628,288,454,600,473,447,181,219,182,303,532,245,486,684,393,482,234,326]},{"vehicle":2,"start_time":57600,"visits":[28,345,527,334,400,602,193,313,492,489,513,540,551,579,262,367,11,389,649,521,298,553,590,252,204,175,640,511,116,74,263,254,40,260,397,9,643,30,671,699,604,491,654,121,329,256,549,189,591,394,110,301,253,635,539,414,304,235,428,352,411,248,218,583,239,246,171,197,324,621,469,416,169,520,336,47,232,627,118,227,445,587,657,332,676,228,626,434,224,170,693,3,585,292,533,685,686,205,537,34]},{"vehicle":3,"start_time":57600,"visits":[27,117,599,485,437,79,139,368,543,346,459,507,379,233,477,388,338,512,89,631,403,177,75,217,322,698,668,308,306,363,425,483,124,453,192,536,231,37,51,385,191,442,644,524,570,214,130,98,339,616,14,210,622,634,421,167,417,386,681,359,341,426,236,328,409,674,136,94,623,39,402,162,42,103,10,675,96,337,695,287,407,49,689,325,565,15,90,658,444,636,259,297,178,637,107,355,343,113,465,168,618,456,441,289,478,223,112]},{"vehicle":4,"start_time":57600,"visits":[380,387,283,190,581,78,69,595,331,679,59,142,318,448,431,451,282,593,33,432,529,598,383,285,615,202,63,267,446,652,647,384,180,611,498,415,93,276,531,700,377,578,481,266,601,413,497,126,176,588,488,641,612,476,127,91,152,499,199,526,270,617,151,77,542,138,99,528,457,131,314,206,455,247,264,35,135,250,305,6,275,82,38,327,430,440,68,269,54,490,670,519,12,311,257,115,510,76,195,122,212,351,550,23,56,295,104,690,134,62,284,344,150,114,196,73,358,95,500,464,683,60,279,682,65,348,72,240,36,613]},{"vehicle":7,"start_time":57600,"visits":[480,340,61,211,16,594,381,624,530,424,677,111,92,52,172,166,630,487,145,398,547,31,45,419,605,697,501,149,567,620,390]},{"vehicle":9,"start_time":57600,"visits":[350,148,335,133,479,100,651,575,645,25,174,406,84,548,203,546,105,655,376,128,280,88,290,680,271,556,603,101,161,580,607,564,364,472,44,315,373,596,468,502,639,517,158,582,392,399,249,462,420,568,141,678,0,405,525,317,518,449,187,586,563,589,120,574,58,370,365,21,22,638,198,106,452,660,559,323,395,522,154,516,687,87,144,342,230,70,43,372,435,125,320,475,265,378,13,458,470,129,361,608,577,71,221,66]},{"vehicle":13,"start_time":57600,"visits":[662,664,691,382,225,557,625,523,293,552,672,401,555,201,64,17,299,597,188,29,484,67,673,347,222,554,229,614,663,474,696,642,650,19,268,493,576,165,375,429,281,1,545,173,357,238,291,366,494,460,220,179,321,226,560,184,261,20,5,515,562,506,207,209,592,159,646,433,277,467,438,412,4,185,504,237,307,362,278,558,360,404,356,667,561,137,648,108,26,83,463,461]}],"unserved":[],"runtime_ms":261492.2,"meta":{"duration":121851,"service":0,"cost":121851,"routes":7,"assigned":701,"unassigned":0,"repaired_drops":0}}