{"instance":"pb-0193","solver":"jsprit","routes":[{"vehicle":0,"start_time":30600,"visits":[69,84,96,60,35,72,97,17,52,37,74,88,83,15,29,2,22,25,75,31,57,78,27,87,65,58,77,50,34,14,103]},{"vehicle":2,"start_time":30600,"visits":[3,98,30,28,79,85,95,13,94,71,92,38,8,16,93,51,86,62,20,105,10,21,104,70,33,5,99,64]},{"vehicle":3,"start_time":30600,"visits":[80,54,23,43,61,0,46,9,6,59,26,56,42,63,32,89,55]},{"vehicle":1,"start_time":34200,"visits":[100,48,68,39,73,47,44,101,82,91,24,106,18,67,19,66,102,7,1,40,45,81,76,36,12]},{"vehicle":4,"start_time":34200,"visits":[11,41,4,53,49,90]}],"unserved":[],"runtime_ms":211.9,"meta":{}}