{"instance":"pb-0016","solver":"routific","routes":[{"vehicle":0,"start_time":36000,"visits":[62,38,5,68,4,63,56,33,53]},{"vehicle":1,"start_time":50400,"visits":[49,44,10,39,29,9,71,51,42,11,66]},{"vehicle":2,"start_time":54000,"visits":[28,14,1,52,46,37,12,23,36,69,7]},{"vehicle":3,"start_time":50400,"visits":[17,64,59,57,13,60,73,72,25,16,31,2,24,54]},{"vehicle":4,"start_time":61200,"visits":[22,35,34,61,3,18,43,74,32,20,30,45]},{"vehicle":5,"start_time":43200,"visits":[0,15,27,8,70,6,41,47,40]},{"vehicle":6,"start_time":63000,"visits":[26,65,48,21,19,67,55,50]}],"unserved":[58],"runtime_ms":552,"meta":{"benchmark_id":2487,"best_of":"ls"}}