{"instance":"pb-0098","solver":"jsprit","routes":[{"vehicle":4,"start_time":0,"visits":[233,286,299,318,342,110,55,275,182,312,352,356,70,216,138,240,293,248,307,82,163,377,149,0,258,74,351,106,213,41,105,366,320,330,10,378,272,326,253,256,128,322,266,185,39,243,349,174,93,102,132,72,136,29,89,171,222,47,287,129,170,270,337,234,285,251,339,355,52,76]},{"vehicle":0,"start_time":0,"visits":[230,6,317,67,205,37,329,116,140,255,151,201,245,199,232,197,210,156,284,195,88,345,66,333,121,260,316,114,325,131,306,162,267,30,276,104,155,36,302,87,150,211,99,79,14,183,100,277,109,11,68,98,346,218,250,344,86,209,108,364,273,198,122,341,244,107,358,81]},{"vehicle":1,"start_time":0,"visits":[85,196,305,123,235,254,80,350,241,263,142,281,159,193,231,367,18,229,13,249,207,96,274,176,59,120,69,224,50,264,38,17,186,65,7,179,354,321,95,261,304,75,45,164,208,376,202,73,206,353,111,268,125,178,194,139,191,168,1,291,61,294,374,143,313,97,361,3]},{"vehicle":2,"start_time":0,"visits":[4,343,247,184,126,297,362,21,158,372,166,152,133,146,309,228,187,20,242,319,371,310,101,49,347,332,91,265,238,296,167,135,335,380,43,239,28,22,219,31,271,90,60,40,370,57,278,334,103,365,327,203,145,53,246,137,348,259,360,369,257,204,54,51,363,124,359,357]},{"vehicle":3,"start_time":0,"visits":[262,324,236,379,177,56,157,175,83,48,165,119,127,25,153,34,46,172,373,173,71,368,292,147,27,15,24,279,226,311,134,280,115,92,323,26,19,303,225,78,301,161,33,288,223,42,23,77,315,8,112,331,160,62,252,314,144,117,44,58,94,295,130,9,32,148,269,212]}],"unserved":[2,5,12,16,35,63,64,84,113,118,141,154,169,180,181,188,189,190,192,200,214,215,217,220,221,227,237,282,283,289,290,298,300,308,328,336,338,340,375],"runtime_ms":13323.2,"meta":{}}