{"instance":"pb-0131","solver":"routific","routes":[{"vehicle":0,"start_time":37920,"visits":[10,35,25,16,32,1,21,11,44,3,15,24,27,26,4,28,31,38,13,0,5,9,20,8,34,45,30,36,29,33,39,17,41,14,42,6,18,40,23,37,43,19,12,22,2,7]}],"unserved":[],"runtime_ms":119,"meta":{"benchmark_id":2104,"best_of":"ls"}}