{"instance":"pb-0251","solver":"ortools","routes":[{"vehicle":0,"start_time":27000,"visits":[31,33,27,34,21,17,13,6,9,23,12,25,19,20,0,4,35,8,11,10,24,26,7,29,28,18,32,5,16,1,22,30,3,15,2,14]}],"unserved":[],"runtime_ms":2000.1,"meta":{"duration":10615,"service":4320,"cost":10615,"routes":1,"assigned":36,"unassigned":0}}