{"instance":"pb-0065","solver":"pyvrp","routes":[{"vehicle":0,"start_time":23400,"visits":[39,46,35,54,66,51,42,56,12,61,68,25,17,2,14,59,5,64,30,6,19,8,9,13,27,0,21,28,74,69,52,34,60,76,71,33,7,1]}],"unserved":[3,4,10,11,15,16,18,20,22,23,24,26,29,31,32,36,37,38,40,41,43,44,45,47,48,49,50,53,55,57,58,62,63,65,67,70,72,73,75],"runtime_ms":2029.8,"meta":{"duration":13131,"service":6840,"cost":821211,"routes":1,"assigned":38,"unassigned":39,"repaired_drops":0}}