{"instance":"pb-0222","solver":"routific","routes":[{"vehicle":0,"start_time":0,"visits":[1041,241,302,417,20,372,49,845,706,529,851,998,1027,1104,455,636,130,124,677,827,332,1010,66,624,473,963,297,550,11,505,392,254,599,294,1050,238,470,334,883,961]},{"vehicle":1,"start_time":0,"visits":[418,657,801,217,791,502,606,610,195,1119,866,357,990,1015,58,571,333,951,578,1017,508,728,623,654,9,876,250,668,712,923,246,380,247,1025,62,839,808,40,160,864,799,946,396,644,324,1070,273,526,746,1023,917,391,1002,1022,493,687,1081,605,815,259,400,611,651,769,819,971,198,430,1109,803,768,949,600,156,423,439,1118,888,563,218]},{"vehicle":2,"start_time":0,"visits":[55,186,263,927,270,468,53,536,298,992,229,12,711,1038,586,544,633,228,679,750,381,1071,587,954,490,977,103,492,503,152,206,33,139,936,748,227,1013,822,730,556]},{"vehicle":3,"start_time":0,"visits":[1037,809,187,695,630,291,56,538,690,1087,365,210,158,969,739,485,482,840,1061,500,869,189,354,643,964,528,116,1035,249,215,792,709,98,794,652,970,676,870,829,132]},{"vehicle":4,"start_time":0,"visits":[65,1107,564,699,288,1030,953,580,960,1062,347,93,459,355,1096,962,906,305,655,986,649,570,816,146,787,1001,574,837,140,941,810,862,105,807,121,733,914,1077,613,616]},{"vehicle":5,"start_time":0,"visits":[894,848,157,377,551,480,488,589,125,133,387,471,321,641,200,880,336,722,435,69,225,1113,1033,101,300,202,959,921,178,592,299,284,329,890,376,338,670,1123,436,208]},{"vehicle":6,"start_time":0,"visits":[489,982,1043,738,707,447,572,394,558,735,666,1028,1004,314,533,1006,245,797,1059,175,495,318,5,553,540,933,780,800,522,454,161,882,48,1078,301,784,180,413,144,1099]},{"vehicle":7,"start_time":0,"visits":[1044,590,1060,989,80,939,46,622,804,751,584,35,322,258,44,196,242,937,764,114,525,266,830,385,30,561,10,421,916,704,972,99,647,789,585,57,1110,252,274,169]},{"vehicle":8,"start_time":0,"visits":[781,1055,223,1114,487,770,705,997,104,95,697,682,595,956,292,496,1057,446,192,591,59,901,1020,326,1018,752,370,60,183,476,474,701,743,472,73,995,337,696,823,642,860,975,813,513,1125,532,688,63,162,1051,915,548,523,741,576,315,692,887,179,15,766,665,194,637,673,820,783,569,264,631,96,221,320,1056,514,988,852,149,930,900]},{"vehicle":9,"start_time":0,"visits":[148,406,268,601,280,656,497,615,27,775,340,875,844,398,1011,167,566,518,306,1116,861,524,886,120,356,1100,28,737,621,450,903,805,222,957,919,499,583,786,541,165]},{"vehicle":10,"start_time":0,"visits":[204,97,1066,555,404,612,629,740,353,171,141,881,542,1094,853,352,838,662,1115,34,660,573,667,675,931,818,531,191,304,778,412,832,833,885,821,19,504,628,1097,193]},{"vehicle":11,"start_time":0,"visits":[763,899,234,985,1012,309,47,451,23,462,993,978,891,694,4,1026,411,442,128,779,45,39,449,243,1,721,575,1092,21,393,824,1031,364,112,1076,902,155,117,924,1067]},{"vehicle":12,"start_time":0,"visits":[397,477,341,143,545,715,1101,627,350,812,402,203,256,926,1089,1085,260,758,1084,719,593,1095,170,725,448,920,669,828,1091,366,123,717,367,720,253,61,846,311,235,984,108,0,1008,581,534,88,383,910,214,653,74,77,205,445,275,626,686,1086,434,13,843,836,38,512,431,552,718,620,150,2,907,16,458,475,153,577,289,22,403,640]},{"vehicle":13,"start_time":0,"visits":[520,774,36,6,723,678,942,765,92,1083,236,922,151,849,777,440,661,635,1039,349,607,86,944,209,145,67,51,177,363,535,107,216,181,42,115,351,68,510,429,231]},{"vehicle":14,"start_time":0,"visits":[484,224,802,1129,91,316,759,395,102,1045,650,307,25,373,974,847,1106,782,645,943]}],"unserved":[3,7,8,14,17,18,24,26,29,31,32,37,41,43,50,52,54,64,70,71,72,75,76,78,79,81,82,83,84,85,87,89,90,94,100,106,109,110,111,113,118,119,122,126,127,129,131,134,135,136,137,138,142,147,154,159,163,164,166,168,172,173,174,176,182,184,185,188,190,197,199,201,207,211,212,213,219,220,226,230,232,233,237,239,240,244,248,251,255,257,261,262,265,267,269,271,272,276,277,278,279,281,282,283,285,286,287,290,293,295,296,303,308,310,312,313,317,319,323,325,327,328,330,331,335,339,342,343,344,345,346,348,358,359,360,361,362,368,369,371,374,375,378,379,382,384,386,388,389,390,399,401,405,407,408,409,410,414,415,416,419,420,422,424,425,426,427,428,432,433,437,438,441,443,444,452,453,456,457,460,461,463,464,465,466,467,469,478,479,481,483,486,491,494,498,501,506,507,509,511,515,516,517,519,521,527,530,537,539,543,546,547,549,554,557,559,560,562,565,567,568,579,582,588,594,596,597,598,602,603,604,608,609,614,617,618,619,625,632,634,638,639,646,648,658,659,663,664,671,672,674,680,681,683,684,685,689,691,693,698,700,702,703,708,710,713,714,716,724,726,727,729,731,732,734,736,742,744,745,747,749,753,754,755,756,757,760,761,762,767,771,772,773,776,785,788,790,793,795,796,798,806,811,814,817,825,826,831,834,835,841,842,850,854,855,856,857,858,859,863,865,867,868,871,872,873,874,877,878,879,884,889,892,893,895,896,897,898,904,905,908,909,911,912,913,918,925,928,929,932,934,935,938,940,945,947,948,950,952,955,958,965,966,967,968,973,976,979,980,981,983,987,991,994,996,999,1000,1003,1005,1007,1009,1014,1016,1019,1021,1024,1029,1032,1034,1036,1040,1042,1046,1047,1048,1049,1052,1053,1054,1058,1063,1064,1065,1068,1069,1072,1073,1074,1075,1079,1080,1082,1088,1090,1093,1098,1102,1103,1105,1108,1111,1112,1117,1120,1121,1122,1124,1126,1127,1128,1130],"runtime_ms":48838,"meta":{"benchmark_id":2130,"best_of":"ga"}}