{"instance":"pb-0225","solver":"vroom","routes":[{"vehicle":0,"start_time":0,"visits":[446,283,65,405,148,565,151,109,5,330,453,371,168,110,316,425,290,253,429,581,46,342,302,466,209,196,38,57,238,166,449,356,569,474,164,367,200,336,301,4,134,457]},{"vehicle":1,"start_time":0,"visits":[251,157,450,515,201,180,382,436,188,184,88,69,370,146,147,463,75,9,139,195,487,45,282,27,288,445,14,315,194,261,368,6,129,223,478,98,502,348,224,439,90,508]},{"vehicle":2,"start_time":0,"visits":[403,269,404,94,289,401,42,273,414,504,527,44,339,549,408,332,89,50,193,171,225,250,451,358,537,62,340,383,509,352,79,458,170,299,464,384,462,270,386,202,263,232]},{"vehicle":3,"start_time":0,"visits":[227,254,480,392,138,247,145,107,334,10,441,496,362,48,510,378,160,360,435,494,314,96,76,136,135,118,440,489,116,291,523,454,131,531,17,544,355,203,503,424,214,402]},{"vehicle":4,"start_time":0,"visits":[54,239,173,52,364,554,0,221,220,399,541,125,265,128,249,295,119,117,120,281,521,256,473,363,557,208,381,31,343,493,556,53,137,547,114,97,126,142,43,244,550,64,20]},{"vehicle":5,"start_time":0,"visits":[476,154,359,258,226,507,222,255,344,279,576,286,300,578,162,174,277,86,165,434,351,432,341,559,572,143,149,102,501,161,276,11,111,61,105,313,262,284,312,481,178,413]},{"vehicle":6,"start_time":0,"visits":[234,532,379,486,499,230,555,535,303,219,329,181,325,233,16,512,121,275,400,176,361,257,422,293,81,427,491,130,418,150,26,482,55,317,452,372,35,500,566,68,444,1,95]},{"vehicle":7,"start_time":0,"visits":[545,49,469,517,248,552,155,212,122,13,296,438,395,498,25,169,144,528,448,407,211,385,236,571,91,124,179,475,306,416,437,71,346,40,345,175,420,580,324,397,2,78,259]},{"vehicle":8,"start_time":0,"visits":[443,243,369,183,374,421,393,12,574,335,63,252,15,205,56,326,564,513,92,333,187,543,182,563,32,77,433,198,396,274,471,520,271,376,533,548,409,113,37,172,229,492,546]}],"unserved":[579,577,575,573,570,568,567,562,561,560,558,553,551,542,246,245,242,241,240,237,235,231,228,218,217,216,215,213,210,207,206,204,199,197,192,191,190,189,186,185,177,167,163,159,158,156,153,152,141,140,133,132,127,58,51,47,41,39,36,34,33,30,29,8,7,3,18,19,21,22,23,24,28,59,60,66,67,70,72,73,74,80,82,83,84,85,87,93,99,100,101,103,104,106,108,112,115,123,260,264,266,267,268,272,278,280,285,287,292,294,297,298,304,305,307,308,309,310,311,318,319,320,321,322,323,327,328,331,337,338,347,349,350,353,354,357,365,366,373,375,377,380,387,388,389,390,391,394,398,406,410,411,412,415,417,419,423,426,428,430,431,442,447,455,456,459,460,461,465,467,468,470,472,477,479,483,484,485,488,490,495,497,505,506,511,514,516,518,519,522,524,525,526,529,530,534,536,538,539,540],"runtime_ms":102043,"meta":{"routes":9,"unassigned":200,"duration":21054,"cost":21054}}