{"instance":"pb-0222","solver":"pyvrp","routes":[{"vehicle":0,"start_time":0,"visits":[637,597,469,546,841,565,1098,179,671,260,376,145,829,823,296,100,755,767,154,828,930,1115,342,103,940,952,663,949,425,553,588,453,614,1112,31,1090]},{"vehicle":1,"start_time":0,"visits":[187,1010,595,501,346,369,830,1068,904,944,883,860,791,204,467,124,891,240,516,415,150,183,222,526,632,173,343,691,675,757,1018,106,107,739,512,79]},{"vehicle":2,"start_time":0,"visits":[295,1050,284,243,775,877,249,25,486,879,318,428,322,551,605,1027,185,983,40,1105,985,785,439,681,766,928,160,1055,275,81,1127,933,349,535,771,563]},{"vehicle":3,"start_time":0,"visits":[997,1066,34,128,868,95,1102,174,313,903,707,1104,510,304,996,982,900,410,873,395,402,780,381,536,566,876,21,538,156,611,362,542,220,1081,530,45]},{"vehicle":4,"start_time":0,"visits":[436,518,319,366,852,878,476,537,169,683,963,129,1053,227,779,262,271,171,238,524,760,962,465,137,226,688,666,172,223,33,669,347,805,90,30,979]},{"vehicle":5,"start_time":0,"visits":[353,38,984,280,270,1026,462,743,352,1070,91,814,555,276,682,122,109,333,645,907,117,569,1113,327,872,27,905,897,96,808,151,942,8,684,431,981]},{"vehicle":6,"start_time":0,"visits":[571,269,800,770,759,520,971,947,574,317,1020,263,159,799,742,307,9,647,207,773,1004,615,334,380,777,341,700,746,1003,703,233,556,1014,336,418,209]},{"vehicle":7,"start_time":0,"visits":[748,709,97,1111,694,301,797,527,622,241,277,115,407,464,62,217,383,388,258,584,1011,251,11,959,1099,908,219,132,977,85,176,215,73,573,806,1029]},{"vehicle":8,"start_time":0,"visits":[285,839,846,83,816,686,792,456,15,728,936,478,302,927,934,131,1109,398,430,617,195,420,184,454,66,484,1044,788,51,1106,50,557,360,345,818,141]},{"vehicle":9,"start_time":0,"visits":[517,689,745,403,850,577,357,1025,166,819,837,842,1015,447,590,1062,1,1125,939,690,989,152,864,733,170,444,335,461,370,182,790,676,612,326,713,496]},{"vehicle":10,"start_time":0,"visits":[495,338,912,293,1034,784,631,754,63,225,120,874,783,589,274,429,1114,432,659,175,506,521,1040,252,781,1036,442,87,712,125,514,838,1103,32,765,290]},{"vehicle":11,"start_time":0,"visits":[371,287,485,749,69,673,922,951,1016,596,608,261,796,245,22,163,1024,834,354,1126,1017,76,1067,1005,446,1101,1019,412,216,1030,705,887,246,500,119,457]},{"vehicle":12,"start_time":0,"visits":[477,214,657,192,426,303,121,667,316,379,734,1074,199,167,508,592,328,460,153,161,236,533,970,1092,44,94,365,256,519,751,471,740,858,901,320,1071]},{"vehicle":13,"start_time":0,"visits":[310,917,640,180,19,337,273,881,625,1078,1046,59,421,965,618,643,1051,1069,323,498,289,497,111,1038,409,1048,193,88,108,158,646,1091,110,133,1056,292]},{"vehicle":14,"start_time":0,"visits":[1042,255,809,726,391,324,4,49,572,71,865,687,630,1049,747,92,377,358,144,297]}],"unserved":[0,2,3,5,6,7,10,12,13,14,16,17,18,20,23,24,26,28,29,35,36,37,39,41,42,43,46,47,48,52,53,54,55,56,57,58,60,61,64,65,67,68,70,72,74,75,77,78,80,82,84,86,89,93,98,99,101,102,104,105,112,113,114,116,118,123,126,127,130,134,135,136,138,139,140,142,143,146,147,148,149,155,157,162,164,165,168,177,178,181,186,188,189,190,191,194,196,197,198,200,201,202,203,205,206,208,210,211,212,213,218,221,224,228,229,230,231,232,234,235,237,239,242,244,247,248,250,253,254,257,259,264,265,266,267,268,272,278,279,281,282,283,286,288,291,294,298,299,300,305,306,308,309,311,312,314,315,321,325,329,330,331,332,339,340,344,348,350,351,355,356,359,361,363,364,367,368,372,373,374,375,378,382,384,385,386,387,389,390,392,393,394,396,397,399,400,401,404,405,406,408,411,413,414,416,417,419,422,423,424,427,433,434,435,437,438,440,441,443,445,448,449,450,451,452,455,458,459,463,466,468,470,472,473,474,475,479,480,481,482,483,487,488,489,490,491,492,493,494,499,502,503,504,505,507,509,511,513,515,522,523,525,528,529,531,532,534,539,540,541,543,544,545,547,548,549,550,552,554,558,559,560,561,562,564,567,568,570,575,576,578,579,580,581,582,583,585,586,587,591,593,594,598,599,600,601,602,603,604,606,607,609,610,613,616,619,620,621,623,624,626,627,628,629,633,634,635,636,638,639,641,642,644,648,649,650,651,652,653,654,655,656,658,660,661,662,664,665,668,670,672,674,677,678,679,680,685,692,693,695,696,697,698,699,701,702,704,706,708,710,711,714,715,716,717,718,719,720,721,722,723,724,725,727,729,730,731,732,735,736,737,738,741,744,750,752,753,756,758,761,762,763,764,768,769,772,774,776,778,782,786,787,789,793,794,795,798,801,802,803,804,807,810,811,812,813,815,817,820,821,822,824,825,826,827,831,832,833,835,836,840,843,844,845,847,848,849,851,853,854,855,856,857,859,861,862,863,866,867,869,870,871,875,880,882,884,885,886,888,889,890,892,893,894,895,896,898,899,902,906,909,910,911,913,914,915,916,918,919,920,921,923,924,925,926,929,931,932,935,937,938,941,943,945,946,948,950,953,954,955,956,957,958,960,961,964,966,967,968,969,972,973,974,975,976,978,980,986,987,988,990,991,992,993,994,995,998,999,1000,1001,1002,1006,1007,1008,1009,1012,1013,1021,1022,1023,1028,1031,1032,1033,1035,1037,1039,1041,1043,1045,1047,1052,1054,1057,1058,1059,1060,1061,1063,1064,1065,1072,1073,1075,1076,1077,1079,1080,1082,1083,1084,1085,1086,1087,1088,1089,1093,1094,1095,1096,1097,1100,1107,1108,1110,1116,1117,1118,1119,1120,1121,1122,1123,1124,1128,1129,1130],"runtime_ms":100485.2,"meta":{"duration":226054,"service":0,"cost":null,"routes":15,"assigned":524,"unassigned":607,"repaired_drops":16}}